{
  "schema_version": "octon-mini.bootstrap.setup-question-catalog.v2",
  "document_role": "authoritative_guided_setup_question_catalog",
  "permission_grant": false,
  "catalog_version": "2.0.0",
  "modes": ["initialization", "adoption", "upgrade"],
  "information_roles": [
    "observation",
    "inference",
    "initialization_input",
    "recommendation",
    "owner_selection",
    "accepted_authority_reference",
    "runtime_authorization_forbidden"
  ],
  "validity_policy": {
    "schema_version": "octon-mini.setup-validity.v1",
    "classes": [
      "re_observe_every_run",
      "source_fingerprint_bound",
      "dependency_bound",
      "expiry_bound",
      "decision_successor_or_revocation_bound",
      "runtime_only_never_reusable"
    ],
    "role_defaults": {
      "observation": ["re_observe_every_run", "source_fingerprint_bound"],
      "inference": ["re_observe_every_run", "dependency_bound"],
      "initialization_input": ["dependency_bound"],
      "recommendation": ["re_observe_every_run", "dependency_bound"],
      "owner_selection": ["dependency_bound"],
      "accepted_authority_reference": ["dependency_bound", "decision_successor_or_revocation_bound"],
      "runtime_authorization_forbidden": ["runtime_only_never_reusable"]
    },
    "reinspection_classifications": [
      "preserved",
      "reobserved",
      "needs_confirmation",
      "invalidated",
      "newly_introduced"
    ],
    "rules": [
      "Every stored question state binds its exact question definition and dependency-state digests.",
      "Evidence with an expiry adds expiry_bound even when its role default does not include it.",
      "Governing-instruction changes require confirmation or invalidation for affected non-observational inputs.",
      "An unrelated target edit does not invalidate a state whose declared bindings remain identical.",
      "Accepted decisions are reusable only through a current project-owned decision-reuse record bound to an accepted unsuperseded decision.",
      "Runtime authorization is never collected, persisted, inferred, or reused."
    ]
  },
  "questions": [
    {
      "id": "setup.target-identity",
      "version": 1,
      "family": "project_generation",
      "modes": ["initialization", "adoption", "upgrade"],
      "dependencies": [],
      "trigger_conditions": [],
      "prompt": "Which exact target directory is being inspected?",
      "importance": "Every observation, plan, fingerprint, and apply precondition must refer to one exact target.",
      "answer": {"type": "string", "valid_values": [], "allow_unknown": false, "allow_deferred": false, "allow_not_applicable": false},
      "blocking": true,
      "recommendation": {"rule": "observe the canonical target path", "rationale": "The target is safely observable and must not be guessed."},
      "authoritative_destination": "setup_session.target_identity",
      "information_role": "observation",
      "evidence": {"required": true, "freshness_days": null, "allowed_sources": ["filesystem_observation"], "requirements": ["canonical path", "target type"]},
      "sensitivity": {"classification": "project_internal", "collection_restrictions": ["record a path only", "do not read outside the bounded target"]},
      "validation_rules": ["absolute canonical path", "must match the session target"],
      "migration_behavior": "Re-observe for every successor session.",
      "change_consequences": "A changed target invalidates the session and any generated plan."
    },
    {
      "id": "setup.detected-mode",
      "version": 1,
      "family": "project_generation",
      "modes": ["initialization", "adoption", "upgrade"],
      "dependencies": ["setup.target-identity"],
      "trigger_conditions": [],
      "prompt": "Does the target evidence support initialization, adoption, or upgrade?",
      "importance": "The three modes preserve different preconditions and authority boundaries.",
      "answer": {"type": "enum", "valid_values": ["initialization", "adoption", "upgrade", "ambiguous"], "allow_unknown": false, "allow_deferred": false, "allow_not_applicable": false},
      "blocking": true,
      "recommendation": {"rule": "derive only from target content and valid Octon Mini provenance", "rationale": "Ambiguous provenance must stop rather than be inferred."},
      "authoritative_destination": "setup_session.mode",
      "information_role": "observation",
      "evidence": {"required": true, "freshness_days": null, "allowed_sources": ["filesystem_observation", "octon_mini_provenance"], "requirements": ["empty/new check", "established-content check", "origin provenance check"]},
      "sensitivity": {"classification": "non_sensitive", "collection_restrictions": ["do not query hosted systems"]},
      "validation_rules": ["ambiguous is never plan eligible", "requested mode must equal observed mode"],
      "migration_behavior": "Recompute on every inspection.",
      "change_consequences": "A changed mode requires a new session."
    },
    {
      "id": "setup.governing-instructions",
      "version": 1,
      "family": "existing_authority",
      "modes": ["initialization", "adoption", "upgrade"],
      "dependencies": ["setup.target-identity"],
      "trigger_conditions": [],
      "prompt": "Which applicable target instructions were observed?",
      "importance": "Setup must obey project-local instructions and detect changes before planning or applying.",
      "answer": {"type": "string_list", "valid_values": [], "allow_unknown": false, "allow_deferred": false, "allow_not_applicable": false},
      "blocking": true,
      "recommendation": {"rule": "enumerate applicable instruction files", "rationale": "Instruction paths and bytes are directly observable."},
      "authoritative_destination": "setup_session.governing_instruction_fingerprint",
      "information_role": "observation",
      "evidence": {"required": true, "freshness_days": null, "allowed_sources": ["filesystem_observation"], "requirements": ["path and content fingerprint"]},
      "sensitivity": {"classification": "project_internal", "collection_restrictions": ["store fingerprints and paths, not duplicate instruction content"]},
      "validation_rules": ["paths must reconcile with the instruction fingerprint"],
      "migration_behavior": "Re-observe; never copy instructions into a setup answer.",
      "change_consequences": "Any instruction change invalidates the session and plan."
    },
    {
      "id": "setup.octon-mini-provenance",
      "version": 1,
      "family": "project_generation",
      "modes": ["initialization", "adoption", "upgrade"],
      "dependencies": ["setup.detected-mode"],
      "trigger_conditions": [],
      "prompt": "What Octon Mini version and provenance are present?",
      "importance": "Upgrade requires valid installed provenance; initialization and adoption must not invent it.",
      "answer": {"type": "object", "valid_values": [], "allow_unknown": true, "allow_deferred": false, "allow_not_applicable": false},
      "blocking": true,
      "recommendation": {"rule": "read and validate origin metadata when present", "rationale": "Version and provenance are observable and must not be inferred from filenames."},
      "authoritative_destination": "setup_session.octon_mini",
      "information_role": "observation",
      "evidence": {"required": true, "freshness_days": null, "allowed_sources": ["octon_mini_provenance", "filesystem_observation"], "requirements": ["installed version", "candidate version", "provenance status"]},
      "sensitivity": {"classification": "non_sensitive", "collection_restrictions": ["do not treat provenance as project-policy authority"]},
      "validation_rules": ["upgrade requires valid provenance", "new questions never inherit answers by default"],
      "migration_behavior": "Record both installed and candidate versions in each session.",
      "change_consequences": "Version or provenance change invalidates the session."
    },
    {
      "id": "setup.project-name",
      "version": 1,
      "family": "project_generation",
      "modes": ["initialization", "adoption"],
      "dependencies": ["setup.detected-mode"],
      "trigger_conditions": [],
      "prompt": "What plain-language project name should the generated snapshot use?",
      "importance": "The name identifies the generated snapshot without establishing product or governance authority.",
      "answer": {"type": "string", "valid_values": [], "allow_unknown": false, "allow_deferred": false, "allow_not_applicable": false},
      "blocking": true,
      "recommendation": {"rule": "may propose the directory name as a candidate", "rationale": "A filesystem name can help, but the user must select the project name."},
      "authoritative_destination": ".agent/project.json:project.name",
      "information_role": "initialization_input",
      "evidence": {"required": false, "freshness_days": null, "allowed_sources": ["user_selection", "project_authority"], "requirements": ["non-empty plain text"]},
      "sensitivity": {"classification": "non_sensitive", "collection_restrictions": ["no personal data unless intrinsic to the project name"]},
      "validation_rules": ["1 to 200 characters", "no control characters or template delimiters"],
      "migration_behavior": "Existing CLI --project-name maps to this ID.",
      "change_consequences": "Changing it before apply changes generated bytes and invalidates the plan digest."
    },
    {
      "id": "setup.project-slug",
      "version": 1,
      "family": "project_generation",
      "modes": ["initialization", "adoption"],
      "dependencies": ["setup.project-name"],
      "trigger_conditions": [],
      "prompt": "Should the generated project slug differ from the portable slug derived from the project name?",
      "importance": "The slug becomes a stable generated identifier and should be deliberate when overridden.",